### ISSUE TITLE
How to communicate with ros2 node?

### ISSUE THREAD

**Issue by liyue75** [eProsima/Fast-DDS#1835]
I run a ros2 example: **cpp_pubsub talker** with predefined msg.   
And I want to use  fastdds  to receive the data from ros2 node.   

## Expected Behavior

DDS subscriber should receive the data from ros2 node.

## Current Behavior

There seems to be a problem with  datatype when discovery process.

## Steps to Reproduce

1. Create a ros2 node with predefined topic( [http://docs.ros.org/en/eloquent/Tutorials/Custom-ROS2-Interfaces.html](url))
2. My msg file(tutorial_interfaces/msg/Num.msg):  
`int64 num` 
3. The ros2's default fastrtps version is 1.9, and there may be  no shm transport, so I use    
 `export FASTRTPS_DEFAULT_PROFILES_FILE=path/to/xml/pub.xml` to specify interface.
4. The pub.xml is :
```
<?xml version="1.0" encoding="UTF-8"?>
<dds xmlns="http://www.eprosima.com/XMLSchemas/fastRTPS_Profiles">
        <profiles>
          <transport_descriptors>
            <transport_descriptor>
                <transport_id>udp_transport</transport_id>
                <type>UDPv4</type>
                <interfaceWhiteList>
                    <address>192.168.1.8</address>
                </interfaceWhiteList>
            </transport_descriptor>
        </transport_descriptors>

        <!-- PUBLISHER -->
        <participant profile_name="participant_profile" is_default_profile="true">
            <domainId>0</domainId>
            <rtps>
                <name>data_pub</name>
                <useBuiltinTransports>false</useBuiltinTransports>
                <userTransports>
                    <transport_id>udp_transport</transport_id>
                </userTransports>
            </rtps>
        </participant>
        <publisher profile_name="topic" is_default_profile="true">
            <qos>
                <reliability>
                    <kind>BEST_EFFORT</kind>
                </reliability>
                <durability>
                    <kind>VOLATILE</kind>
                </durability>
                 <publishMode>
                        <kind>SYNCHRONOUS</kind>
                </publishMode>
            </qos>
        </publisher>
    </profiles>
```
5. **Here is another problem**: If I use `RMW_FASTRTPS_USE_QOS_FROM_XML=1 ros2 run cpp_pubsub talker`   
to overwrite ros's ASYNCHRONOUS_PUBLISH_MODE, error occurs:   
`terminate called after throwing an instance of 'eprosima::fastcdr::exception::NotEnoughMemoryException'   
  what():  Not enough memory in the buffer stream`
So I just run `ros2 run cpp_pubsub talker` with ros's default QOS. The ros2 talker node can send data now.
6. On Fast-DDS side, my IDL file(data.idl):
```
module tutorial_interfaces {
  module msg {
    struct Num {
      int64 num;
    };
  };
};
```
I use fastddsgen to generate this IDL into soucre files.
7. And I write a FastDDS code to accept data, it use sub.xml  to set its attributes. My sub.xml is:
```
<?xml version="1.0" encoding="UTF-8"?>
<dds xmlns="http://www.eprosima.com/XMLSchemas/fastRTPS_Profiles">
        <profiles>
          <transport_descriptors>
            <transport_descriptor>
                <transport_id>udp_transport</transport_id>
                <type>UDPv4</type>
                <interfaceWhiteList>
                    <address>192.168.1.8</address>
                </interfaceWhiteList>
            </transport_descriptor>
        </transport_descriptors>

        <!-- SUBSCRIBER -->
        <participant profile_name="sub_participant_profile">
            <domainId>0</domainId>
            <rtps>
                <name>data_subscriber</name>
                <useBuiltinTransports>false</useBuiltinTransports>
                <userTransports>
                    <transport_id>udp_transport</transport_id>
                </userTransports>
            </rtps>
        </participant>
        <subscriber profile_name="sub_subscriber_profile">
            <topic>
                <name>topic</name>
                <dataType>tutorial_interfaces::msg::Num</dataType>
                <kind>NO_KEY</kind>
            </topic>
            <qos>
                <reliability>
                    <kind>BEST_EFFORT</kind>
                </reliability>
                <durability>
                    <kind>VOLATILE</kind>
                </durability>
            </qos>
        </subscriber>
    </profiles>
```
8. I run the dds sub with this xml file, but it doesn't seem to match the pub.
9. There is no error in the code because the dds sub can receive from other dds pub, and the ros2 talker can send to   
other ros2 listener.
10. I use tcpdump to capture the network traffic:
```
22:22:22.475696 IP liyue-ThinkPad-T470-W10DG.49685 > 239.255.0.1.7400: UDP, length 256
22:22:24.369893 IP liyue-ThinkPad-T470-W10DG.36738 > 239.255.0.1.7400: UDP, length 248
22:22:24.372030 IP liyue-ThinkPad-T470-W10DG.36738 > 239.255.0.1.7400: UDP, length 248
22:22:25.470955 IP liyue-ThinkPad-T470-W10DG.49685 > 239.255.0.1.7400: UDP, length 256
22:22:25.473216 IP liyue-ThinkPad-T470-W10DG.49685 > 239.255.0.1.7400: UDP, length 256
22:22:27.370465 IP liyue-ThinkPad-T470-W10DG.36738 > 239.255.0.1.7400: UDP, length 248
```
I guess maybe the data type don't match.
I think the data types on both  side is **tutorial_interfaces::msg::Num**, is that wrong?

**My questions in short**: 
1. How to use Fast-DDS communicate with Ros2? Is there any example?
2. Why run ros2 program with RMW_FASTRTPS_USE_QOS_FROM_XML=1 returns an error?
                       
## System information

 - FASTRTPS v2.2.0
 - ROS2 version: eloquent(fastrtpsv1.9.3 as middleware, and I update to fastrtps2.2.0, but none of them work)
- OS: Ubuntu 18.04

**Comment by liyue75** [comment]
Here are some answers to these questions: [https://github.com/osrf/ros2_raw_dds_example](url).
As it says, 
```
The QoS of the publisher and subscriber have to match. This is true for all participants in the network that wish to communicate.
The topic that the raw DDS participant uses must begin with rt/.
The type that the raw DDS participant uses must be of the form <namespace>::msg::dds_::<Type>_.
```
so I modified my sub.xml with ros2 compatible topic name and type, and modify 
dataPubSubTypes.cxx 's `setName` function.
And I add 127.0.0.1 in interfaceWhiteList(because I find after specify UDP transport, the interface fastrtpsv2.2 used to send userdata on same host is lo, and the interface used to send metatarffic data is 192.168.1.8)
After that my Fast-DDS sub could receive from ROS2 node.

Now, there's just one problem: 
when I run `RMW_FASTRTPS_USE_QOS_FROM_XML=1 ros2 run cpp_pubsub talker`
error occurs:
`terminate called after throwing an instance of 'eprosima::fastcdr::exception::NotEnoughMemoryException'`    
  `what(): Not enough memory in the buffer stream`

**Comment by EduPonz** [comment]
Hi @liyue75 ,

Great to hear that you made the communication work! In any case, Fast DDS-gen has a `-typeros2` option to generate ROS 2 compatible type support for Fast DDS. I'm leaving a tutorial on how this was solved for a similar case [here](https://gist.github.com/EduPonz/bea0edf3e1ac366560eff62cceb5ddf9).

Regarding the `NotEnoughMemoryException`, that's a relatively easy fix. As explained [here](https://github.com/ros2/rmw_fastrtps#full-qos-configuration), setting `RMW_FASTRTPS_USE_QOS_FROM_XML=1` makes `rmw_fastrtps` to configure history memory policy as `PREALLOCATED_MEMORY_MODE` (unless specified otherwise in the XML). This is in general a problem with ROS 2 standard messages, since they are unbounded. To fix your issue, you should just set the history memory policy to `PREALLOCATED_WITH_REALLOC_MEMORY_MODE`. You can check an example [here](https://github.com/ros2/rmw_fastrtps#example).

**IMPORTANT**: Mind that instructions in the README file are intended for master branch, so no all the features described in there are available in Eloquent. Nonetheless, the one with the publication mode and history memory policy does apply.

Please let me know whether you require further assistance.

**Comment by liyue75** [comment]
@EduPonz Thank you, it is all right now.
